year,title,excerpt
2001,Brazil's inflation rose only 0.28 percent in September compared with 0.7 percent in August,central bank increases its 2001 inflation projection to 6.5 percent (S) World Business Briefing | Americas: Brazil: Inflation Slows
2004,"Kinder Morgan Energy, pipeline partnership, acquires Kaston Pipeline Co from Western Refining for about $100 million in cash","pipeline can carry as much as 115,000 barrels of oil daily from fields in West Texas (S) KINDER MORGAN ENERGY BUYS OIL PIPELINE IN TEXAS"
1954,"Willets, A: Sting of Glory Off the Rue Michelet",STING OF GLORY. By Ann Willets. 302 pp. New York: Random House. $3.50.
1927,"Rigaud, D, girl, killed MISSING GIRL DEAD IN ELEVATOR SHAFT",Body Found Twelve Hours After School Chums and Others Stared Hunt for Her.
1999,"BRUSTMAN-Marianne Delaney. Of Stuart, FL, and Mamaroneck, NY, and former longtime resident of Larchmont, NY, died Saturday, October 30. She was 61. She is survived by her husband Leonard W. Brustman Jr. and by her daughters Suzanne Montanaro (Dr. Joseph) of Wyndham, NH, Joanne Brustman of NYC, Kathleen Rasor (Richard) of Larchmont, NY, and Karen Brustman of Red Hook, NY. Daughter of the late T. Ronald Delaney and Julia Coye Delaney. Mrs. Brustman is also survived by her brothers T. Gerald Delaney of Santa Fe, NM, and Michael C. Delaney (Charlotte) of Tequesta, FL, and sisters Sharon D. O'Connell (John) of Atlanta, GA, and Susan D. Cline (John) of Scottsdale, AZ. She was predeceased by her sister Sheila D. Griffin (Dr. William) of Lincoln, NE. Five grandchildren also survive, Zachary, Emily, and Paige Montanaro, and Drew and Ryan Rasor. Visiting will be Monday, 7-9 PM, and Tuesday, 2-4 and 7-9 PM, at the John J. Fox Funeral Home, Inc., 2080 Boston Post Road, Larchmont, NY. Mass Wednesday, 10 AM, at St. Augustine Church in Larchmont. Paid Notice: Deaths  BRUSTMAN, MARIANNE DELANEY",
1969,"Drs H Wells, D Rasmussen and I E Buff tour W Va mining towns to arouse miners and pub to demand that state Legis provide compensation for disability caused by 'black lung' disease","hold long-range aim is to make disease so expensive for mine operators that they will take steps to 'clean up mines'; Hechler pledges aid; issue has divided med profession; Wells accuses Dr C Andrews, vp for med affairs at W Va Univ, of supporting opinion that disease can be traced to cigarette smoking; Andrews denies making statement Doctors Leading Fight to Curb Miners' Disease; Tour West Virginia to Seek Union's Help -- Companies Blamed for 'Black Lung'"
1930,PITT FIVE OVERCOMES SYRACUSE BY 31 TO 28,Plays Safe Game After Taking Early 12-4 Lead to Triumph on Home Court.
1990,"In ""Salome,"" Richard Strauss's music and Oscar Wilde's setting make promises to the listener that few performers are able to fulfill. One looks to the stage for life-threatening beauty, dancing feet, a soprano voice of Brunnhildean proportions and a level of psychosexual madness unprecedented in opera.    The Metropolitan Opera's newest version of ""Salome,"" which returned to the house on Thursday night, simply adds to the pressures. The production and design were created two years ago by Nikolaus Lehnhoff and Jurgen Rose. Tall stone facades tilt inward. Skewed floors and doors defy the rectangular equilibrium of the Met's stage. Review/Opera",Timeless Depravity in Met's New 'Salome'
1993,"More than 40 people were killed early today when part of an Amtrak train hurtled off a 12-foot-high trestle into a bayou and caught fire, trapping sleeping passengers in black water up to 30 feet deep.   The accident, one of the worst on American rails since World War II and the deadliest in Amtrak's 23-year history, occurred about 3 A.M., when the Sunset Limited from Los Angeles was crossing Big Bayou Canot at 70 miles per hour on its way to Miami with 189 passengers and a crew of 17. DOZENS ARE KILLED IN WRECK OF TRAIN IN ALABAMA BAYOU",
1975,"WEDNESDAY, MAY 21, 1975 Money",
2011,Joe Blanton and Jon Lester may have the answer. How Weird Can It Get?,
1962,Four Groups to Donate Blood,
1973,"Backus, Dana C (Mrs) Mrs. Dana C. Backus, 66 , Dead",A Leader in World Peace Drive
1943,"trainees introduce NYC atmosphere into Orlando, Fla, jungle warfare training area NEW YORK RBBORN IN SOLDIERS' JUNGE",Streets in Florida Air Tactics Training Camp Named After Those of the Metropolis
1967,Army presses drive against guerrillas,charges E C Guevara has been in country twice to aid bands BOLIVIANS PRESSING DRIVE ON GUERRILLAS
2019,"The Consumer Product Safety Commission stopped short of a recall of the Rock ’n Play seat, but the American Academy of Pediatrics demanded its withdrawal. Why a Fisher-Price Sleeper Linked to Infant Deaths Hasn’t Been Recalled",
1968,"Occidental Petroleum Corp files suits, Fed and state cts, Los Angeles, Calif, charging Texaco with attempting to restrain trade and commerce in exploration of oil reserves, Latin Amer",suits are counter actions to suits filed by Texaco Suit Filed Against Texaco By Occidental Petroleum
1945,"Arrives, Trieste MOSCOW INFORMED",POTENTIAL TROUBLE CENTER IN SOUTH EUROPE
1987,"LEAD: Britain's Glaxo Holdings P.L.C., one of the world's biggest drug companies, today reported a 22 percent jump in its annual pretax profits to $:746 million, or $1.23 billion, but that was well below analysts' expectations. Glaxo Profit Up, Stock Off",
1945,"AAR repts: carloadings, wkly CARLOADINGS RISE SLIGHTLY IN WEEK","868,634 Total Is 3.6 Per Cent More Than Week Before, 0.2 Per Cent Below '44 Figure"
1966,Dr Rusk and A M Rosenthal named to US State Dept advisory panel on E Asian and Pacific affairs 19 Experts on Asia Are Named by Rusk As Advisory Panel,
1955,Obituary 1 -- No Title,
1958,"Salmony, Alf 'RED SONN, EXPERT ON JADE, 67",Retired Professor at N.Y.U. Fine /rts' School Dies on Liner En Route to Europe
1977,"IARRIVE four minutes late for the interview with my old friend, Mandel Perodin, but it doesn't matter. He has made each one of them productive by studying for the graduate philosophy course he's taking. SPEARING PERSONALLY",
1946,"Stuart, J","Tales from the Plum Grove Hills Twenty Tales, Regional and Readable"
1938,Sermons on: greatness WHISPERING' DRIVE IN ELECTION SCORED,Injecting of Religious Issue Is Held Contrary to American Spirit in Sermons Here REFUGEE APPEAL HAILED Panic Over Broadcast Linked to Fear of Hitler-Other Topics Discussed by Rabbis
1937,"With a total of 58,295 shipments, gross revenue from the air express business of the Railway Express Agency for December showed an increase of 80 per cent over the gross revenue for the new and old contract airlines in the same month last year.   BUSINESS NOTES",
1928,BLOUSES to wear with the new ensembles in which the threequarters and seven-eighths  length coats predominate are quite attractive.   BLOUSES ARE SEEN IN NOVEL DESIGNS,
1935,STOCK MARKET INDICES.,International Average Up to 52.4 From 51.9 Week Before.
1977,IMF says that gold to be sold at Sept 7 auction will be delivered in NYC (S) Gold Delivery Set for New York,
2011,"A New York-bound bus was carrying 58 passengers when it rolled over on Interstate 95, about 30 miles north of Richmond. Driver Arrested After Fatal Bus Crash in Virginia",Carrier Has Record of Violations
1982,"AFTER having been given a bad name by Adam and Eve, the apple has made a steady upward climb to the top of the heap. As the No. 1 fruit in the country, this year's harvest will be some 204 million bushels, nearly a bushel for each of us. Of that number, 110 million will be sold fresh","the rest processed into a variety of products, including cider, juice and applesauce.

The Northeast is second to the Far West in production, with 74,658,000 bushels, nearly two-thirds of which are produced in New York. The state of Washington alone produces nearly as many apples as the Northeast. GARDENING;
SOME NEW VARIETIES OF APPLES"
2006,"Nortel Networks names IBM executive Dietmar Wendt as chief executive, effective May 1 (S) World Business Briefing | Americas: Canada: Nortel Names I.B.M. Executive to Global Post",
1946,Sold,illus IN NEW OWNERSHIP
1978,"WASHINGTON, March 13&#8212",The Ilnited States and West Germany announeel series of joint actions today to stabilise the value of the dollar and to demonstrate greater agreement on basic economic policy. PLAN IS ANNOUNCED BY U.S. AND GERMANY TO STABILIZE DOLLAR
1972,Sociological survey of Soviet working women shows that those with professional skills appear to make the best mothers and most efficient housewives,"finds that unskilled workers, in contrast, tend to use an excessive amt of time in household chores and are too exhausted to devote themselves to their children; working women are rule rather than exception in USSR, where they comprise 50% of labor force; study of 2,000 women in Moscow region was designed to assess interplay between career and family life; survey results contrast with widespread Western view that career women become so engrossed in professional life that they neglect home and children; suggest that careers and family life can be harmoniously combined by women with educ and occupational skills; historian Z Yankova gives rept on survey at recent internatl seminar on sociology of the family that met in Moscow under auspices of Soviet Sociological Assn WORKING MOTHERS STUDIED IN SOVIET"
2003,Grace Glueck reviews exhibit Manet and the American Civil War: The Battle of USS Kearsarge and CSS Alabama at Metropolitan Museum of Art,"photo (M) Sunk at Sea, and Captured on Canvas"
1933,Survey of prices PRICE SURVEY BRINGS OPPOSITION TO RISES,Wholesale Trend From 1929 on Some Products Is Held Even to Warrant Cuts.
1955,Israel scores failure to condemn Egypt ISRAELIS CHIDE U. N. FOR ACTION ON EGYPT,
1964,"Crown Hts and Prospect Hts, Bklyn, designated neighborhood improvement dists 2 AREAS DESIGNATED FOR IMPROVEMENTS",
1942,On the Carolina Coast,
2001,"Firefighter Lawrence Webb suffers fatal heart attack while fighting house fire in Newark, NJ (S) Metro Briefing | New Jersey: Newark: Firefighter Dies",
1947,Confs with Comr Bollaert BOLLAERT SEES BAO DAI,Indo-China Commissioner Talks With Annam's Ex-Emperor
1965,"IN 1857 Lieutenant Joseph C. Ives, Topographical Engineer, was commissioned to test the navigability of the mighty Colorado River north of Yuma and a wagon route linking it with the Mormon Road to Los Angeles. Ives's account of his mission by pre-fab steamboat and mule train, published in 1861, is here abbreviated for young readers.   STEAMBOAT UP THE COLORADO. Edited by Alexander L. Crosby. Illustrated. 112 pp. Boston: Little, Brown & Co. $4.50.",
1939,"The four-story flat on a plot 25 by 100 feet at 613 Westchester Avenue in the Bronx was sold by the Bowery Savings Bank to a client of the Eugene J. Busher Company, Inc., which negotiated the deal in cooperation with Peter Clancy. The purchaser will modernize the property.   BANK SELLS IN THE BRONX",Flat at 613 Westchester Ave. Passes to New Control
1970,Fanfani abandons efforts to form new center-left coalition,gives up after Christian Dem and Socialist parties rejected his demand that pol secs of all 4 coalition parties accept cabinet posts as guarantees of good conduct Fanfani Abandons His Effort To Form Center‐Left Coalition
2016,"A Florida man who espoused anti-Islamic views on social media was charged with setting a fire that damaged a mosque in Fort Pierce, Fla., the authorities said. Arrest Made in Arson at Mosque That Orlando Nightclub Gunman Attended",
2013,"The FedEx Cup playoffs have provided great theater, but the start of autumn brings back college football and the N.F.L., and the playoffs may not be delivering a new audience. The Season When Golf and Football Collide",
1974,"Dyckman, Richard P Richard P. Dyckman, 78, Ex‐Mayor of Plainfield, N.J.",
2010,"Elaine Stritch, Chita Rivera and Ben Vereen are among the stars scheduled to perform in a series presented by Hartford Stage. A Series With 3 Broadway Luminaries",
1937,Closes Toledo plant Automobile Plant Closes Today,
1953,Guatemalan Min Osegueda to visit other Central Amer Mins,move seen last attempt to prevent proposal for action against Communist infiltration at coming Central Amer Foreian Mins Conf GUATEMALAN PLANS TALKS; Foreign Chief Will Tour Other Central American States
1951,Church to Mark Anniversary,
1989,"LEAD: Elizabeth Vogel and John M. Schmidt were married yesterday at St. Vincent the Martyr Roman Catholic Church in Madison, N.J., by the Rev. James Reedy. Elizabeth Vogel Wed To John M. Schmidt",
1991,"Iraq's parading of captured pilots in front of television cameras, their faces bruised and their statements apparently made under coercion, and its threat to use them as human shields is reminiscent of the Iraqi treatment of Iranian prisoners during the Iran-Iraq war.    During the long border war, Iranian soldiers, including teen-agers, were routinely interviewed on Iraqi television, presented to foreign journalists and prodded into proclaiming the wisdom of Iraq's President, Saddam Hussein, and the inhumanity of the Iranian Government. The Iraqis also paraded the soldiers through the streets of Baghdad and retrained them as soldiers to fight Iran. WAR IN THE GULF: P.O.W.'s",Iraqi Use of Captured Airmen: Old Tactics
1933,I C C hearing on proposed merger of Reading and Pa R Rs in Southern N J READING HEARD BY I.C.C.,Merger of Southern Jersey Lines With the Pennsylvania Is Urged.
1951,US State Dept confirms getting Indian note,silent; Philippines to send group to San Francisco conf to seek support for amendments; Jap press repts on plan to sign US-Japan security pact at conf and on Jap representation plan U.S. HAS INDIA'S REPLY ON JAPANESE TREATY
1989,"LEAD: Namibia's independence is finally on the horizon after more than 100 years of bitter struggle. Tomorrow, United Nations peacekeeping forces, now on Namibia's soil, begin to guide the independence process. Our people, jubilant, appreciate that their presence marks the culmination of a long colonial era. In Namibia, Jubilation and Caution",
1938,"Feeling a bit jaded after their strenuous efforts in yesterday's tempestuous double-header, the Giants today were forced to beat a rather embarrassing retreat as the Pirates sent them tumbling to a 7-to-4 defeat in the series final.   Pirates Triumph Over the Giants and Regain Half-Game Lead in Pennant Race","COFFMAN POUNDED AS GIANTS LOSE, 7-4 Yields Four Pirate Runs in Seventh--Rizzo Homer Off Gumbert Nets Three SWIFT STOPS tATE RALLY New Yorkers Shell Blanton, Crossing Plate Thrice in Eighth Inning Noisy Crowd Hails Victors Scoreless Till Sixth Frick Fines Rizzo $25"
1985,"Bishop James W. Malone, the head of the American Roman Catholic delgation to an extraordinary Synod of Bishops that opens here Sunday, has raised the possible need for changes in key church policies in remarkably candid comments before a group of Catholic foundation heads.   Bishop Malone, president of the National Conference of Catholic Bishops, said there were extreme conditions that would warrant an end to mandatory celibacy for priests. He also suggested a means by which Catholics who disagree with the church's ban on artificial birth control might consider the rule an ''ideal'' rather than an immediate demand.   He also criticized Joseph Cardinal Ratzinger, the head of the Vatican Congregation for the Doctrine of the Faith, for being ''one of the obstacles'' to improving what Bishop Malone described as poor relations between bishops and theologians. ON EVE OF ROME SYNOD, A TOP U.S. BISHOP SEES POSSIBLE NEED FOR CHANGES",
2003,Drought of new drugs at GlaxoSmithKline discussed,"company has introduced just three new medicines since merger that formed it in 2000; top scientists who recently left company, including Dr Peter G Traber, say laboratory productivity is getting worse; blame merger, factor of key significance in industry that has rapidly consolidated, in part because of long drought at lab; chief executive Dr Jean-Pierre Garnier dismisses comments of former employees; holds company's drug pipeline is fine; graphs of new drugs, merger deals and market share; photos (M) Where Are All the New Drugs?"
1947,"Tibbitts, Frank J FRANK J. TIBBITTS",
1951,Survey on student earnings EDUCATION NOTES,Varied Activities on the Campus And in the Classroom KENYON--Washington Study CHILD GUIDANCE--Psychologists PENN. WOMEN--Examinations CORNELL--Course on India CONNECTICUT--Graduate Music DELAWARE--Human Relations WESLEYAN--Students Earn Money EDUCATION--In Brief
1931,"CHICAGO, Jan. 16.--Bearish conditions dominated the wheat market today and prices on the Board of Trade here dropped around 2 cents from Thursday's finish, with ...   ALL GRAINS DECLINE AS BUYING SLACKENS","Wheat, Which Lost 1 to 1 5/8c, and Corn, 3/8 to 5/8c Off, Feel Bearish Sentiment. ARGENTINE INFLUENCE SEEN --Oats Raily Toward Last, Some Deliveries Going Up 1/8c--Trading in Rye is Dull. Manitobas Bought by Europe. Corn Is Heavy in Undertone. Chicago. Minneapolis."
1921,"It was a large night in the life of Murph', the Lambs Club bootblack. Murph' had been scrubbed and manicured, attired in gaudy raiment, his hair oiled and combed back into a distinguished wave, and hurried forth into that gay life with which he was familiar only through the words caught ...   BOOTBLACK A BARON, SHINES ON ONE NIGHT",Lambs Club Members Disguise Shoe Polisher in Dress Suit and Take Him to See Leon Errol. HE ALMOST SNUBBED ACTOR But Errol Recognized Murph' and Impostor Was Overcome by Emotion at Dinner That Followed.
1923,Pres Ely says Federation of Tenants' Assns will send reprs to Albany to watch Legis and to oppose real estate lobby,removal of Comr Mann will be sought TENANTS TO MOUNT GUARD AT ALBANY; President Ely Says the Federa- tion Will Watch Rent Legislation.
1944,"mass for liberation, Holy Cross Acad, NYC Mass for Liberation of Holland",
1955,"NYCTA asks City Planning Comm for $353,689,776, '56 capital budget","gen mgr Bingham explains all but $150,000 would be outside city debt limit; says $18.4 million is for pending projects JACK WOULD RAZE SUBWAYS' KIOSKS; Favors Removal of 100 Old Structures Before 1958-- Seeks '56 Planning Fund $2,620,532 TOTAL ASKED Bingham Says Requested Allocation Is Exempt From Debt Limit in Large Part"
1957,7-day embargo set,price rise seen FLORIDA EMBARGO RAISES FRUIT PRICE
1921,Obituary 3 -- No Title,
1959,French Line Aides Promoted,
1966,"Internatl Team Trials, Pittsburgh Bridge:",International Team Trials Begin Today in Pittsburgh
1955,"MORGANTOWN, W. Va., Oct. 22 -- West Virginia passed its stiffest football test of the season today as it rallied to beat Penn State, 21 -- 7.   West Virginia Rallies to Check Penn State With Three Second-Half Scores",MOSS SHOWS WAY FOR 21-7 TRIUMPH
1963,Brentwood Stock Offering,
1994,"Two churches in central Harlem were designated landmarks last week.    The First Corinthian Baptist Church, at Adam Clayton Powell Jr. Boulevard and 116th Street, was once the luxurious Regent Theater. It was finished in 1913, at the time when the film industry was making the transition from nickelodeons. Its terra cotta facade, modeled after the Doge's Palace in Venice, was designed by Thomas W. Lamb, who went on to specialize in lavish movie theaters across the United States. It became a church 30 years ago. 2 Churches Named Landmarks",
1957,Walworth Names Three,
1942,Jersey Food Prices Up Slightly,
2012,The Transportation Department said this week it would award $17.5 million in grants to states that outlaw texting while driving. Wheelies: The Carrot-and-Stick Edition,
1926,"State Repubs to ask removal of J H Lee, Prohibition Administrator, as incompetent, and reprimand for M O Dunning, coordinator for So Atlantic States on ground of naming relatives to dry enforcement posts SEEK TO OUST DRY CHIEFS.",Florida Republicans Will Demand Removal of Lee and Dunning.
1951,Jegge--Kruk,
1928,Hoover forces win 11 delegates in contests before Natl Com HOOVER FORCES WIN ELEVEN DELEGATES AS CONTESTS OPEN,National Committee Votes by Decided Majorities Against Bean's Nine From Florida. AN UPSET FOR THAT STATE Hilles Supports His Fellow Committeeman in Opposition to Hoover Group. TWO MORE FROM KENTUCKY Secretary's Total Put at 422--Pennsylvania Fails to Show ItsHand.
1927,Composer to Marry Writer.,
1975,NEW YORK (AP) &#8212,Money rates for Tuesday. Money
1991,"Current fashion comes out of a roiling, boiling caldron, a catchall of disparate elements. A number of ""C"" words go into conjuring up the soup of style. First off, it's handy to have a sprinkle of Chanelisms to toss in for flavor. (Outright copies come in handy, too.) For fall, a seasoning of vintage Courreges spices things up considerably as well. True creativity is great, but most good ideas have a cachet of times past. It takes courage to make a conversation piece, but sometimes it is what gives a designer's collection charisma. Comfort may sound colorless, but often it is what clinches the sale of clothes to a satisfied customer. (Let there be more of her!) Fortunately, there were only a few catastrophes this season, with every designer aiming for a chic statement. Some achieved it. So let's count the successes and call them out loud and clear. THE HIGH C's OF STYLE",
2013,You have a few ways to bring your phone numbers with you when moving from an Android smartphone to a new Windows Phone 8 handset. Q&A: Moving Contacts to a New Phone,
1992,"When USAir flight 405 skidded into the water at La Guardia Airport last night, the effects were quickly felt seven miles to the southeast, at Kennedy International Airport.   With hundreds of rescue workers fanned out across La Guardia's runways, some arriving flights were immediately diverted to Kennedy. Quickly, the Effects Are Felt at Kennedy",
1966,Greece prepares for launching of 9 Eur Space Research Orgn rockets from Euboea Is during May 20 eclipse,US experts to make observations from Greece GREECE IS PREPARING FOR ECLIPSE PROBES
1946,Extension of cooperative engineering advisory services expected to ease motorists problems,bd functions cited TECHNIQUE OF WAR TO BENEFIT AUTOS; Extension of Advisory Group to base Workaday Problems of the Average Motorist
2017,"This Comedy Central show, in which a professional life-reviewer hosts a show-within-a-show, is in its third and final season. ‘Review,’ a Workaholic’s Slapstick Tragedy Nears Its End",
1923,gives slang of the screen Jargon of The Studio,
1942,WHITE SOX TRIP SENATORS,"Humphries Victor on Mound, 7-2, in Game Under Lights"
1975,"Dwight-Englewood School (NJ), in effort to raise money, will make 5 new all-weather tennis cts, now being constructed on campus, available to families who donate minimum of $300 to Dwight-Englewood Development Fund",school's development office head Dr Roger Cooley comments (M) School Is Using Tennis to Raise Funds
1961,General Electric and Westinghouse announced yesterday that they would defend the suits against them.   2 Companies Defend Prices,
1966,"The New York Flea Market will reopen for the fall season Sept. 11, when it will commemorate the first United States performance of Jenny Lind, at the Castle Garden Theater in 1850.   Flea Market to Reopen With a Jenny Lind Day",
1930,Feature article by R Owen on clerical workers in bread lines,illus THE ARMY OF THE UNEMPLOYED HAS DRAWN STRANGE RECRUITS; APPLES BECOME A SYMBOL OF UNEMPLOYMENT.
1930,Reviews of Recorded Music RECORDED MUSIC,A Schubert Sonata for the Arpeggione--The Flonzaleys in a Brahms Quartet
2008,Scientists have discovered a previously unknown virus and strongly linked it with the most aggressive form of skin cancer. Virus Is Linked to a Powerful Skin Cancer,
1935,Spreckels Trophy,S Dollar to be only Amer entrant DOLLAR TO RACE ABROAD.; Will Be Only U.S. Entrant in Motor Boat Regatta in Paris.
1951,"With the smallest crowd of the season trying to peer at the proceedings through the downpour, William Ewing's Auditing carried the high weight to victory in the Gramercy Park Handcap at Belmont Park yesterday. Rigged at 120 pounds with Nick Wall in the saddle, Auditing registered a onelength victory over Easy Whirl of the Hampton Stable in the mile event.   Co-Favored Auditing Takes Gramercy Park","Belmont Double Returns $1,107.60; A HIGH-FLYING WINNER CROSSES LINE IN THE RAIN"
1965,GaynerTulin,
1980,"On the day after receiving 10 stitches in his mouth, Muhammad Ali decided yesterday that he could still return to the ring in June but against Scott LeDoux, not against John Tate.   LeDoux Now Seen as Ali Opponent",Only a Small Scar
1960,Article 19 -- No Title,
1978,"J Ray McDermott pleads guilty to charge of defrauding Tenneco Oil of hundreds of thousands of dollars from '71 to '74 through kickback scheme involving $506,000 in bribes paid to Schacht V McCollum, a Tenneco vp, to obtain cost-plus contracts for work in Gulf of Mex","Judge Morey Sears orders McDermott to forfeit $897,000 in extra profits that McDermott is estimated to have earned as result of those contracts; imposes additional fine of $103,000 (S) M'DERMOTT PLEADS GUILTY TO FRAUD, FINED $1 MILLION"
1954,A Goodman urges promotion of US styles,"decries designers follow-the-leader policy; other recommendations, Fashion Group Bergdorf Asks Stress on U. S. Fashions; Tells Stylists to Stop 'Following Leader'"
