year,title,excerpt
1986,"The newest star of the Junkyard Dogs defense - indeed, Georgia's No. 1 threat to opposing quarterbacks - is a Frenchman who grew up in the resort town of Biarritz. Maybe few people in Biarritz have ever heard of Herschel Walker, but nobody at all in Athens, Ga., had ever heard of Richard Tardits when the former member of France's national rugby team paid his own way across the Atlantic and went out for Bulldog football last autumn as a freshman walk-on.   After one season as a special-teams player, though, Tardits - who says he was attracted to the American game because of the ''VEE-o-lance'' - has become so dangerous a pass rusher that the other day Vince Dooley was led to announce a ''battlefield promotion,'' and in a manner that was unprecedented in Dooley's quarter-century as Georgia coach. The 6-foot-2-inch, 225-pound defensive end had already recorded four sacks and otherwise harassed Bulldog quarterbacks throughout a spring scrimmage at Sanford Stadium when Dooley suddenly halted the proceedings, strolled out onto the field and called the entire team together. ''Richard,'' he intoned, ''I'm not going to wait to give you a scholarship for next year. You have proved to me that you should get one now.'' Smashing Barriers",
1987,"LEAD: THE whispers had begun at least as far back as when he was in college, that the gym rat liked to have a few beers, and then a few more than that. Sports of The Times",The Gym Rat
1948,S Benjamin named Fresno mgr Benjamin to Pilot Fresno,
1955,Int,"illus Upbeat for a Song-Writing Duo; Ross and Adler, Broadway's hottest young composers, are rallying from the effects of fame -- bronchiectasis and prosperity-induced depression. Upbeat for a Song-Writing Duo"
1930,Controversy over N Lyon statue on Camp Jackson site stirs city,may be issue in next mayoralty campaign ST. LOUIS ALL UPSET OVER PARK STATUE; Memorial to General Nathaniel Lyon Rouses Bitter Dispute Among Art Critics. MAYOR OFFERS A SOLUTION Advises Those Who Regard Sculpture as Offensive to Look the Other Way as They Pass. Artists Were Aroused. Dispute Becomes Bitter.
1961,Warners to Film 'Formosa',
1975,"description of operations and personnel at NJ's Washington (DC) office, whose functions include channeling legis funding and grant programs to counties in NJ","office is headed by Marilyn Berry; other staff members are Larry Snowhite, Susan Adler and Fariborz Fatemi; Fatemi's job is to coordinate Gov Byrne's personal dealings with NJ Cong delegation, Dem Natl Com and Gov's Conf; in handling legis, staff provides state cabinet members and Gov with rundown of what is in legis hopper; analyzes each of thousands of bills to determine now they will affect both NJ at large and each Cong dist; increased effort by state office has led to steady improvement in amt of Fed money allocated to NJ; illus of Berry with Sen Harrison A Williams (L) State Office Plays Big Role in Capital"
1952,"M Seasongood, J A Simpson, C G Morris named vps Civil Service League Names 3",
1956,Obituary 6 -- No Title,
1978,"Dr. Robin Beth Winkler and Dr. James Halpern Doroshow, physicians, were married yesterday in the Fair Lawn (N. J.) Jewish Center by Rabbi Simon Glustrom. Dr. Robin Winkler Bride Of Dr. James Doroshow.",
1985,"Emerson Fittipaldi - guess which Ralph Waldo was his mother's favorite poet - was shrugging in the rain.   On the other side of the pits, the little cars for Sunday's preliminary race were kicking up rooster-tail plumes of spray yesterday morning. More rain is possible tomorrow, and it can't hurt Fittipaldi's chances in the $640,000 Meadowlands Grand Prix for Indianapolis-type cars.   If auto racing, like horse racing, awarded mud marks for those who performed well on off tracks, the former two-time world driving champion would have one next to his improbable name (his father's name is Wilson, after the President, and Emerson's mother wanted a similar sounding name for her son).   FITTIPALDI STILL ROLLING ALONG",
1941,postcard from Ecuador has German censor stamp Postcard From Ecuador Bears Nazi Censor Stamp,
2002,Turkish Foreign Minister says that Turkey will not extend its term as commander of security force in Afghanistan,NATO diplomats say that Germany had expressed interest in possibly taking over joint command of force in December (S) Turkey to End Its Afghan Stint
1949,shows new power saw BUSINESS WORLD,
1977,"Paul D Dennis Jr article on efforts of LI communities to prevent poor minorities from using beaches, which arc, for most part, accessible only through private beach and yacht clubs (M) A Coast Off Limits to the Poor",
1963,Executive Changes,
2015,"Jan Benzel, a Metro editor, describes this year’s summer series, which she will be assigning and editing. The focus? Summer romance. Summer Lovin’ Takes New York",
1947,Marcantonio Asks 3d Party,
1989,"LEAD:         *3*** COMPANY REPORTS **    *3* Cineplex Odeon (NYSE)       Qtr to Sept 30   1989   1988                     Revenue   187,131,000   223,625,000              Net loss   7,192,000   b14,684,000              Share earns   -   .31              9mo rev   476,964,000   511,145,000              Net loss   35,219,000   b29,807,000              Share earns   -   .63             Cineplex Odeon reports earnings for Qtr to Sept 30",
1954,Got $10 for Story,
1973,NYSE chmn Needham appeals for $300-million increased in fixed comm rates on July 16 at opening of SEC hearing on proposal,"estimates members' losses in first 1/2 of '73 will total $192-million; emphasizes exch's appeal is based entirely on need to offset 18% inflation in costs since Apr '70; SEC staff members J E Evans and L Pickard question Needham's figures on profits; Pickard observes that exch has offered no evidence to show member cos have introduced more efficient methods to reduce impact of inflationary pressures; exch economist W Freund projects June losses at $40-million on basis of available price and vol data; compares monthly profitability figures in '73 with total revenues of $6.2-billion for '72 to show that this yr's revenues are down $124-million on monthly basis; repts indus has cut over-all expenses by $52-million on annual basis, compared with calendar '72, in effort to make back-office operations more efficient; NYSE proposal for 10% increased in rates on all orders from $100 to $5,000 and 15% increase on all orders exceeding $5,000 up to $300,000 noted; ASE counter-proposal for unchanged rate on orders between $100 and $2,500 and 20% increase on orders between $20,000 and $300,000 revd; SEC Acting Chmn H F Owens, responding to earlier news agency rept, denies that exch has already decided to grant exch request DEFICIT FORECAST ON MEMBER FIRMS Needham, in Plea to S.E.C. for Rate Rise, Says Loss May Total $192‐Million"
1940,Newman Takes Skeet Title,
1921,"WASHINGTON, Oct. 20.--After an allday debate on the proposed foreign trade tax exemption clauses in the pending Tax bill, the Senate voted late this afternoon, 36 to 30, to strike from the bill Sections 4 and 5 of Part 1 of the income tax chapter. These sections define the terms ""foreign trader"" and ""foreign trade corporation.""   PAVES WAY TO TAX INCOME FROM ABROAD","Senate Strikes From Bill Clause Defining ""Foreign Traders"" and Corporations. VOTE FOR CHANGE 36 TO 30 Means Elimination Later of Provisions Exempting Incomes Gained in Foreign Trade."
1951,"Offsetting the increase in the previous week, loans to business by New York banks declined $21,000,000 in the week ended on Wednesday.   TRADE LOANS OFF $21,000,000 IN WEEK","Drop for City's Banks Offsets Gains in Previous Period, Reserve Report Shows"
1971,The new&#8208,"issue market, which posted sharp gains over the last two months, lost some of its punch this week but re mained on an even keel as underwriters stepped up their efforts to bring privately held companies public. New Issue Offers Stay on Even Keel In an Active Week"
2013,"The Islanders received shootout goals from Frans Nielsen and John Tavares to defeat the Rangers and gain their first victory at the Garden since Dec. 26, 2009. Starting in 2nd Period, Isles Change Luck at Garden",
2006,"The couple, both employees of the the cable news channel MSNBC, were married on Saturday evening at Cipriani 23rd Street in New York.  Alison Stewart and Bill Wolff",
1935,West Coast seamen on passenger and freight ships win pay rise and reduced working hrs,"applies to AFL unions 9,000 SEAMEN WIN RISE IN PAY ON WEST COAST; Arbitration Board's Award Applies to A.F. of L. Unions -- Tankers Not Affected."
2011,The documentary “Blank City” looks at iconoclastic downtown New York filmmakers in the late 1970s and early ’80s. That ’80s Moment When Nothing and (Almost) Everything Mattered,
1953,Greeks Merge 2 Major Banks,
1994,"About 10 minutes into the Living Theater's 30th-anniversary production of ""Mysteries and Smaller Pieces,"" at the Theater for the New City (155 First Avenue, East Village), the catcalls begin. ""Next!,"" shouts one man. Another yells: ""Go ahead! Move! I dare you!""   Are the voices coming from the audience or from members of the classically iconoclastic troupe? No matter. Tom Walker, the actor who has been standing immobile since the stage lights came up, doesn't stir. Yes, he blinks from time to time. But he remains as resonantly silent as a statue in a church, even when other actors swarm around him in a mock military drill. Remembering the 60's The Living Theater Way",
1929,PRIMROSE FOUR ON TOP.,"Beats Suneagles by 10 to 8, Balding Getting Four Goals."
1961,replies to producer Susskind protest 'POWER AND GLORY',Telecast of Greene Story Raises Issue Of Standards to Be Used by Critic
1934,Mex 1st to bar Chaco arms Mexico Is First to Bar Chaco Arms Shipments,
2011,"Food prices are expected to remain high this year, bringing them close to the crisis levels that provoked shortages and riots in poor countries three years ago. U.N. Data Notes Sharp Rise in World Food Prices",
2006,Research finds that microwave cooking does not destroy nutrients in food,drawing (M) REALLY?
1943,"Gers claim village, same area NAZIS BEATEN BACK IN KUBAN CLASHES",Russians Report Germans Fail With Heavy Losses in Strong Caucasus Counter-Blows BERLIN CLAIMS A VILLAGE Soviet Airmen Raid Junctions and Harry Supply Lines -- Donets Sectors Active
1933,"Mereck, J, killed on tracks of S I Rapid Transit R R Killed by Staten Island Train.",
1950,NEW POWERHOUSE WITH MODERN EQUIPMENT FOR CITY SUBWAY SYSTEM,
1960,"DARIEN, Conn., Sept. 22 -- A charge that anti-Catholic literature was being distributed in the Republican campaign here was made today.   Anti-Catholic Tracts Reported In Darien G.O.P. Headquarters",
2004,"Richard Kopperdahl recalls thrill of climbing to Statue of Liberty's crown years ago Miss Liberty, in a New World",
1948,"McGonigle, Cornelius P REV. C. P. M'GONIGLE",
2013,"Representative Scott Tipton, a Republican of Colorado, rode a Tea Party wave to Congress, but now faces the pressure of his district’s demographics. In Immigration Battle, Advocates for Overhaul Single Out Republicans",
2014,"Prognosticators are giving strong odds to Ava Duvernay’s civil rights film, but they still see few candidates for best actress. Week 1: ‘Selma Rises’ and Lack of Actress Contenders Rankles",
1962,Unit of Allied Chemical Elects Vice President,
1937,"Move for legis investigation of planting of dictographs in office of Gov Ammons and apt of F Dickerson, Dem leader INQUIRY IS PRESSED IN COLORADO SCANDAL",Planting of Dictographs in the Governor's Office Will Go Before the Legislature
1958,"reserves up $125 million to $3,039,000,000, May","graph on changes since '46 Britain's Gold, Dollar Reserves Rose $125,000,000 Last Month"
2008,To the Editor:. Rest in Peace,
1961,LOGART FIGHTS TONIGHT,Jorge Fernandez Will Seek Revenge in Garden Bout
1970,British Soccer Standings British Soccer Standings,
1937,"Fed Reserve Bank rept, June U. S. BUREAU PLACED 224,692 IN JUNE",Jobs Thus Provided in Private Industry Were 81.9% More Than Year Before
1953,UP LAMP POST 55 MINUTES,Lovelorn Seaman Coaxed Down From Perch by Priest
1955,"Wagner, Jno P (Honus) HONUS WAGNER DIES AT AGE OF 81","Shortstop, One of Baseball, Immortals, Made Mark With Pittsburgh Club MANY RECORDS STAND Played Most Games, 2,785, and Led League 8 Times-Lifetime Average of .328"
1955,latter fails to reach accord on sharing research SIDELIGHTS OF THE DAY IN FINANCIAL AND BUSINESS FIELDS,
1969,"Lamb, Karl Barre ARL B. LAMB, 78, OF GLASS STUDIOS",Head of Concern 43 Years Dies -Served in 2 Wars
2015,"A federal judge is expected to rule soon on whether the House can sue the executive branch for usurping its authority over spending. House Republicans, Seizing on Health Law, Challenge Executive Branch",
1936,"Hoover, challenging statement, demands apology Hoover Challenges Statement by Ickes That He Signed Unconstitutional Laws",
1941,Grade-crossing bonds sold STATE BONDS SOLD ON BID OF 101.1099,"City Bank Group Obtains $15,000,000 Grade Crossing Elimination Issue"
2006,A modest Colombian telenovela about a pitifully ugly woman trying to navigate the shallow waters of the fashion industry is remade for American audiences. ABC Brings ‘Ugly Betty’ to America,
1948,"WASHINGTON, May 11 (AP) -The Standard Oil Company of New Jersey today registered 1,265,255 shares of capital stock with the Securities and Exchange Commission. The shares are to be offered in exchange for outstanding common stock of the International Petroleum Company, Ltd., which operates in Peru and Venezuela and has a subsidiary operating in Colombia.   STOCK REGISTERED BY STANDARD OIL",New Jersey Company Lists With SEC Shares for Exchange Among Affiliates
1945,Sen R O Brewster urges Govt speed-up of sale by doing away with red tape WOULD SPEED SALE OF U.S. WAR PLANT,Senator Brewster Proposes 'Round-Table Auction' With All Agencies Represented MEAD IS SAID TO APPROV Project Calls for DPC Official to Preside--Steel Mills in West Are an Issue Representative of Attorney General WOULD SPEED SALE OF U.S. WAR PLANTS Two Groups Interested
1930,FIVE DIE IN MEXICAN WRECK.,Four Were Stealing a Ride on Derailed Freight Train.
1996,"Northeastern's unbeaten crew, ranked fourth in the weekly coaches' poll, defeated No. 3 Harvard by half a boat length today on the Charles River. The Husky eight, whose oarsmen average 6 feet 5 inches and 206 pounds, won their fourth race of the season to capture the Charles Smith Cup for only the third time in the 18-race series.         Also on the Charles, Wisconsin crews swept all three races in the Cochrane Cup regatta, defeating Dartmouth and Massachusetts Institute of Technology, while the Princeton lightweights won the Goldthwaite Cup from Harvard and Yale for the third straight year. The Badger varsity, ranked No. 9, beat the Green, No. 8, by 1.7 seconds and the No. 15 Engineers by 7.5 seconds.    ROWING",Northeastern Upsets Harvard
1937,"A sharper decline than anticipated on the basis of seasonal trend took place in lumber output last week, and the adjusted index eased to 65.7 from 72.4. The figure for the week ended Nov. 14, 1936, was 73.6. Shipments and orders also showed substantial losses from the previous week's totals, according to the reports wired especially to THE NEW YORK TIMES by the regional associations.   Lumber Output Drop More Than Seasonal",Week's Orders Were 31.9% Under Year Ago
1968,"N Korean radio says Pueblo crew submitted joint statement of apology saying they 'deserve any punishment,' admit 'grave crimes' but appeal for leniency WHOLE CREW SORRY, NORTH KOREA SAYS",
1993,"Sheik Omar Abdel Rahman, the radical Islamic cleric whose followers have been linked to two bombing conspiracies in New York City, suffered a setback yesterday in his efforts to stay in the United States as the Board of Immigration Appeals in Washington rejected his request for political asylum.   The board also upheld an earlier order by the Immigration and Naturalization Service that he be expelled. Immigration Board Rejects Sheik's Plea for Asylum",
1920,NEW CORPORATIONS,
1926,"CHICAGO, June 16. -- Wheat showed a firm undertone the greater part of the day, due largely to buying induced by decidedly unfavorable crop reports from France, with private cables suggesting that the yield would be anywhere from 30,000,000 to 60,000,000 bushels less than last year, and the suspension of the import duty into that country until July 31.   EARLY WHEAT GAIN SAGS AT THE FINISH",Good Bulge on Bad Crop Reports From France Checked Later by Profit Taking.
1963,News Summary and Index,The Major Events of the Day International National Metropolitan
2007,"One of Canada’s largest pension funds is in early talks with other pension funds and a private equity firm to form a consortium to mount a $45 billion takeover bid for BCE, the parent company of Bell Canada, The New York Times reported Tuesday, citing people briefed on the discussions. Such a takeover bid would be the largest buyout in history and represent a rare effort by a pension fund, rather than a private equity firm, to lead a buyout of this size.  Funds Said to Consider $45 Billion Bell Canada Bid",
1971,article revs recent Educ Office rept that charges gifted children are neglected in Amer educ,illus Education
1941,Germany to import from USSR under new pact REICH ELATED OVER TREATY,Trade Pact Cited as Reply to Talk of Rift With Soviet
1961,speculation on implications of Gidney ruling WEST RULES OUT SOVIET AUTHORITY ON BERLIN FLIGHTS,"U.S., Britain and France Tell Moscow That It Has No Jurisdiction in Matter CHARGE CALLED 'FALSE' Notes Deny Allies Abuse Use of Corridors -- Red Entry Restrictions Protested WEST AGAIN GIVES A BERLIN WARNING"
1931,THE BABSONS MEET,
1992,"WHEN the Resolution Trust Corporation chose JBS & Associates to auction off $800 million worth of bad consumer, commercial and real estate loans from failed savings and loans, it handed the seven-year-old Chicago real estate consulting and auction firm the largest such assignment in history.   To make things easier on everyone, Joel D. Zegart, president of JBS, has brought computer technology to bear to make it easier for potential bidders to plan for the fire sale of the 43,000 debts last week in Atlanta. Computerizing the Maze Of Savings and Loan Data",
1948,local declines to set gen walkout date,rept on violence between police and pickets holds incident was deliberately planned by pickets WALL ST. PICKETING CONTINUES IN RAIN; But Threat of General Strike Fails to Materialize -- Report Made on Tuesday Battle
1950,"Easter is a day of rededication of faith, and it is also a time when man faces his world with more confidence. This may be  related in part to the fact that he is newly clothed, in the latest mode, with a completeness not usual to any other single day of the year.   Topics of The Times",Season to Begin Again
1992,"They buried Robert Walther yesterday, watched his plain gray coffin into the New Jersey ground, a handful of mourners saying goodbye to a man hardly any of them even knew.    Mr. Walther died a most horrific and dehumanizing death, set on fire, like a heap of trash, by a group of teen-agers as he slept on a subway train in the Bronx. He lived apart and died alone, and perhaps it was fitting that he was buried without the company of anyone who knew the kind of man he had been. They Came to Mourn a Man They Hardly Knew",
1964,"WASHINGTON, Aug. 20 (AP)&#8212","Retail sales for the week ended Aug. 15, were 1 per cent below the preceding week but 6 per cent above the similar 1963 week, the Department of Commerce estimated today. RETAIL SALES IN U.S. RISE 6% FOR WEEK"
1956,Article 1 -- No Title,
1955,Mayor sends silver gondola to NYC Mayor Wagner MAYOR TO GET GONDOLA,Vulcania Captain to Present a Token From Venice
1973,Ski pro J-C Killy discloses on Nov 16 that he will be unable to compete in early events of '73-74 pro ski tour because of a lingering stomach disorder Sports News Briefs,
1973,"Mrs L Boggs announces on Jan 13 that she will be candidate for La Cong seat of her husband H Boggs, who was lost in plane flight in Alaska Oct 16",Boggs was re-elected after his disappearance Mrs. Boggs Will Run For Her Husband's Seat
1971,"ST. PETETISBURGH, Fla., March 1&#8212","Nobody knows ex actly when the New York Mets switched, but late in the nineteen&#8208;sixties they started to search for hitters to help their young pitchers. Now they have half a dozen home&#8208;grown swingers in training who represent the chief change from the team's past and the chief hope for its future. Mets Planning to Stress. More Hits Over Pitching"
1944,S W Farland sentenced for slaying JERSEY SLAYER GUILTY,"Killer of Bartender, 61, Will Go to Prison for Life"
1974,"Sen Philip A Hart accuses Nixon Adm of trying to undermine Amer people's right to privacy, Mar 2 radio speech","calls on Pres Nixon to ban any wiretapping or electronic surveillance unless authorized by ct, to require Fed agencies to obtain subpoenas for telephone records or private business records, and to support stiffer controls on dissemination and use of criminal justice records (M) Hart Says Administration Undermines Privacy Right"
1995,"Continental Airlines Inc. reported yesterday that its earnings more than tripled in the third quarter, exceeding Wall Street expectations.         Analysts said they expected most other carriers to report healthy earnings, as well. The AMR Corporation, parent company of American Airlines, is scheduled  to release its earnings today. Several analysts said AMR's results could also surpass their estimates.    COMPANY REPORTS","CONTINENTAL AIRLINES INC. (CAI.A,N)"
1969,"To become sr partner in law firm of Poletti, Freidin, Prashker, Feldman & Gartner Carter, an Ex-N.A.A.C.P. Aide, New Senior Partner in Law Firm",
1933,Pennland Is Delayed 4 Hours.,
1933,WATERTOWN.,
2002,"Latest nominations in newest Tony category, special theatrical event, noted","all four nominations are for one-person shows by John Leguizamo, Bea Arthur, Elaine Stritch and Barbara Cook; caricatures (Special Section: The Tony Awards) (M) Aren't They Special?"
1933,Golden Rule Sunday observed,"Golden Rule Week begins GOLDEN RULE GIFTS TO HUNGRY ASKED; Roper Leads in Appeal, Hailing Fair Regard for Others as New National Policy. WEEK'S PROGRAM BEGINS Straus Scores Individualism as Philosophy of an Era Eclipsed Since 1930."
2007,"On the larger steelhead rivers of the Pacific Northwest — the Skagit and Bulkley, among others — hooking a steelhead trout on a fly may require a thousand very long casts. Spey Rod Is Long-Range Weapon in Anglers’ Arsenal",
1954,The rules drawn up by the National Labor Relations Board for a new collective bargaining representation election by May 26 among longshoremen in the Port of New York seem sensible and fair. The board's regional officers have a month in which to complete their preparations.   DOCKERS' ELECTION,
2008,President Hamid Karzai of Afghanistan said that he had sought the intervention of the Saudi royal family to bring the resurgent Taliban to peace negotiations. Karzai Sought Saudi Help With Taliban,
1931,SMALL PLANTS MORE ACTIVE.,"May Be First Evidences of Trade Revival, Says Chicago Bank."
1970,"attys and ins indus reprs start broad attack on Rockefeller's ‘no‐fault’ plan, Assembly Ins Com","ridicule plan's predictions of lower costs and broader coverage and call proposal ‘fake,’ a ‘disgrace’ and ‘contrary to the American way of life’; 1 of main objections is that plan would no longer allow victim to sue for losses, including so‐called ‘pain and suffering’ compensation; Stewart defends plan LAWYERS PROTEST INSURANCE PLAN"
1948,NY Fed Reserve Bank lr sees long term rate stability PRESSURE IS EASED ON FEDERAL BONDS,Reserve Bank Review Sees Rise in Confidence in Stability of LongTerm Interest Rates
1939,Annual meeting,officers re-elected Again Heads Jersey Chamber
1995,"The General Electric Company and Mitsui & Company of Japan have been awarded a $200 million contract from Compania Chilena de Generacion Electrica S.A., or Chilgener, to build a gas-fired power station in Santiago.   The contract involves the conversion and expansion of the existing Renca coal-fired power station to natural gas. G.E. and Mitsui Get Chile Job",
1988,LEAD: A PICKUP truck belonging to a unit owner is continually parked in a New Jersey condominium parking lot in violation of house rules that permit only passenger cars. TALKING: House Rules,How Best To Win Compliance
1993,"The phone call, he knew, could change his life. And it scared him. He had been told to expect the call at 3 o'clock last Friday afternoon.   The call was coming from the basketball coach at American University in Washington, and Ronnell Williams, age 18, did not want to miss it. He was the lean, 6-foot-6-inch leading scorer for Taft High School at 29 points a game and an honorable mention on the McDonald's all-America basketball team. He was also an honor student who had succeeded in advanced placement courses like calculus and Latin and had been a student council vice president and had graduated recently in the top 10 percent of his class and who, at about the same time, was convicted of drug dealing. His basketball scholarship hung in the balance, hung on that phone call. The Call of a Lifetime",
1974,MEN'S TRACK EVENTS WOMEN'S FIELD EVENTS WOMEN'S PENTATHLON U.S.‐U.S.S.R. Track Summaries,
1932,ed THE RELIEF SITUATION.,
1952,he and pilgrims visit grottos under St Peter's Basilica Article 2 -- No Title,
1990,"LEAD: Lee A. Iacocca today committed the Chrysler Corporation to producing the Dodge Viper, a high-powered two-seat sports car.   Chrysler Is Set To Build Viper",
1986,*3*** COMPANY REPORTS ** WEBB DEL E. INVESTMENT PROPERTIES reports earnings for Qtr to June 30,
