year,title,excerpt,decade
1995,"Marion Tinsley, the perennial world checkers champion who was widely regarded as the game's best player ever, died in Humble, Tex., on Monday, five years after he ran out of worthy human opponents and began winning his last titles by beating ever more powerful computers. He was 68 and lived in Conyers, Ga.    The cause was cancer, relatives said. He was visiting his twin sister, Mary Clark, in Humble when he died. Marion Tinsley, 68, Unmatched As Checkers Champion, Is Dead",,1990
1997,"Kathleen Mary Phillips, an architect in private practice in New York, was married yesterday to Adam Platt, a freelance writer in New York. The Rev. Rennyson M. Howell performed the ceremony at the Roman Catholic Church of Our Saviour in New York.    The bride, 33, graduated from the Lawrence Institute of Technology in Southfield, Mich., and received an architecture degree from the University of Virginia. Her parents, MaryJane and Gerald Phillips, live in Grosse Pointe Shores, Mich., where her mother is a medical secretary at Bon Secours Hospital. The bride's father is the president of East Side Team Sports in Warren, Mich., which supplies uniforms to the Detroit Red Wings hockey team and the Detroit Pistons basketball team.   Kathleen Phillips and Adam Platt",,1990
1994,"Southern African Traditions Updated With Spirit  Symphony Space    Black Umfolosi, an eight-person a cappella group from Zimbabwe that performed in New York City for the first time on Saturday night, took a handful of Zulu traditions and combined them with the exuberance of youth. The group, which sometimes seems like a younger, smaller version of the South African a cappella group Ladysmith Black Mambazo, often brought its sweet, resonant harmonies down to earth by asking the audience to throw its American Express cards onstage and miming soccer kicks during its dances. POP",,1990
1994,"The United States warned North Korea today that any further delay in releasing a captured helicopter pilot and the body of another could worsen relations at a time when the North has been eager to improve ties with the West.   In the Administration's most emphatic statement since the helicopter went down on Friday, Secretary of State Warren Christopher said, ""We have indicated that a further delay here in returning the pilot and the remains of the co-pilot would be of great concern to us and would affect the atmosphere in which we've been hoping to improve our relations with North Korea."" U.S. Issues New Warning to North Korea Over American Fliers",,1990
1995,"The DDB Needham Dallas Group unit of DDB Needham Worldwide said yesterday that it had hired Jim Ferguson, a senior vice president and creative director at Leo Burnett U.S.A. in Chicago, to become chief creative officer at its three agencies, effective Jan. 30.   Mr. Ferguson, 40, will assume creative leadership at the Dallas Group's Tracy-Locke, Focus and DDB Marketing Communications agencies, overseeing 150 creative employees who work on accounts with billings estimated at $500 million. The accounts include GTE and Pepsi-Cola. He succeeds David Fowler, who was dismissed unexpectedly in October. Burnett Executive Joins a DDB Unit",,1990
1990,"LEAD: With Lawrence Taylor and Leonard Marshall still boycotting the Giants' training camp and five other starters missing while they negotiate new contracts, the team moved to bolster its defense yesterday by picking up a linebacker, Aaron Chubb, on waivers from the Green Bay Packers.   Help for Giants",,1990
1992,"THE VEINS IN HIS forehead bulged so prominently they might have been blue worms that had worked their way under the surface of his skin. His eyes bulged, too, capillaries zigzagging from the pupils in all directions. His face was pulled tight about the jaw, which thrust forward like a snowplow attachment on the grille of a truck. From the flattened O of his mouth, the word ""murderer"" erupted in a regular rhythm, the repetition of the r's giving the word the sound of an outboard motor that failed to catch.   She, for her part, paced up and down directly in front of him, saying nothing. Instead, she held high a large cardboard sign on a stick, showing the cartoonish drawing of a bloody coat hanger over the caption, ""Never again."" Like his, her face was taut with fury, her lips pressed together so tightly they folded under and vanished. Whenever she drew close to him, she would deliberately lower the sign and turn it toward him, so that he would be yelling his ""murderer"" at the picture of the coat hanger. How to End the Abortion War",,1990
1994,"BUYING firewood can be confusing. It is usually sold in a standard unit, a cord, which measures 4 feet wide by 4 feet high by 8 feet long.

Because most homeowners use their fireplaces just occasionally they often require less than a full cord. To accommodate those customers many dealers sell half or quarter cords. Some sell ""face cords"" made up of logs that are cut to more manageable lengths. Four-foot logs do not fit in typical fireplaces. The wood in a face cord might be one or two feet long. If there are doubts about the quantity to purchase, stack the wood and measure it. Compare the measurements with a cord to compare prices. HOME CLINIC",Gauging a Stack of Firewood and Other Tips for Cozy Hearths,1990
1998,Robin Lippincott reviews book Conversations With Joseph Brodsky: A Poet's Journey Through the Twentieth Century by Solomon Volkov (S) Books in Brief: Nonfiction,,1990
1995,*3*** COMPANY REPORTS ** China Resources reports earnings for 2d qtr to Jun 30,,1990
1997,Article on New York Jets preparing for preseason game against Tampa Bay Buccaneers,photo (M) Jets' Starting Lineup Still a Work in Progress,1990
1993,*3*** COMPANY REPORTS ** LSI Industries (NMS) reports earnings for Qtr to Dec 31,,1990
1993,"No matter what else you might say about ""The Wiz,"" the all-black 1974 musical based on L. Frank Baum's classic, ""The Wonderful Wizard of Oz,"" it is an ebullient family crowd-pleaser. And a new production at the Beacon Theater, directed by George Faison and starring Stephanie Mills and Andre De Shields from the original Broadway cast, demonstrates that it doesn't take much to refresh the show, which ran on Broadway for four years. All that's needed is an infusion of contemporary slang and choreography (including a little Michael Jackson moonwalking and sexy L. L. Cool J-style pushups) to bring it up to date.   ""The Wiz"" takes a story so familiar that it doesn't have to be meticulously told to be followed, and reconceives it as a modern vaudeville entertainment with a pop-gospel score. The show is much jollier in tone than the movie ""The Wizard of Oz,"" which conveyed deep currents of Depression-era anxiety and longing for better times. Stephanie Mills's Dorothy has more pluck and brass than Judy Garland's waifish prairie dreamer. And while Ms. Mills's traveling companions on the Yellow Brick Road bemoan their lack of brains, heart and courage, the show's Scarecrow, Tinman and Lion are not so poignantly bereft of self-confidence as their movie counterparts. Review/Theater",Another Excursion To a Hip Land of Oz,1990
1991,"The prosecutor in the Iran-contra case said today that he planned to ask the Supreme Court to review an appellate court decision that set aside the convictions of Oliver L. North.    The prosecutor, Lawrence E. Walsh, made the disclosure in court papers filed with the judge who presided at the 1989 trial of Mr. North, the former White House aide. Mr. Walsh, who had said he would probably ask the High Court to hear the case, filed the papers with Federal District Judge Gerhard A. Gesell. Iran-Contra Prosecutor Is Seeking High Court Review in North Case",,1990
1994,"Dr. Laura Alison Pontrelli, a clinical psychologist in New York, was married yesterday to Frank Adam Fisher, a psychotherapist at the Ginsburg Clinic of the Bronx Psychiatric Center. The Rev. Richard Leonard, a Unitarian Universalist minister, performed the ceremony at the Town Club in New York.   The bride, 33, is keeping her name. She graduated from Bard College and received a master's degree in psychology and a Ph.D. in clinical psychology from the New School for Social Research. She is the daughter of Tania Lipko and Gene Pontrelli, both of Wilmington, Del. The bride's father retired as a physical chemist at E. I. du Pont de Nemours & Company there. Her mother, a mental health counselor at the Fernhook Clinic, is also in private practice in Wilmington. Laura A. Pontrelli And Adam Fisher",,1990
1990,"LEAD:         *3*** COMPANY REPORTS **    *3* Centex Telemanagement (OTC)       Qtr to Dec 31   1989   1988                       Revenue   22,601,000   16,411,000               Net inc   2,069,000   1,544,000               Share earns   .21   .16               Yr rev   82,829,000   60,773,000               Net inc   7,018,000   4,519,000               Share earns   .72   .48                 Centex Telemanagement reports earnings for Qtr to Dec 31",,1990
1997,"Even though Poland has succeeded in reducing air pollution since collapse of Communist rule, it remains criticized by Organization for Economic Cooperation and Development over its dirty air, and upcoming Kyoto, Japan, conference on global warming is expected to add extra pressure","reduction has been achieved, in large part, by investments in desulfurization installations at power plants and gradual phasing out of small emission sources, like coal-burning stoves and boilers; Polish environmental official, Wojtek Ponikiewski, says there is no possibility that country will agree to suggestion by European Union that world's nations commit to 15 percent reduction in greenhouse gases, to 1990 emission levels, by 2010; photo (M) GLOBAL WARMING: Around the Globe, Big Worries and Small Signs of Progress; Poland's Pollution Drops Even as Economy Rises",1990
1994,"*3*** COMPANY REPORTS ** Pier 1 Imports Inc.(PIR,N) reports earnings for Qtr to Aug 27",,1990
1993,"ANONYMOUS selection by number may be a new idea in commissioning composers, but that process has produced a new work by Aaron Kernis, chosen recently in an informal competition. Not only was the process of selection unusual, but also Mr. Kernis's work is the first piece composed as a result of a direct commission for a radio broadcast, said Mary Lee, producer of the public radio program that will broadcast the work.

Mr. Kernis's work, ""Still Movement With Hymn,"" will have its live world premiere in Princeton on Thursday at 8 P.M. and will receive its nationwide radio premiere later on ""St. Paul Sunday Morning,"" Ms.  Lee's program. MUSIC",Unusual Path to a New Work,1990
1992,"PEOPLE reacted intensely when I mentioned I was about to spend two summer weekends in the Catskills. Some got misty-eyed, recalling childhood vacations filled with baseball, horseback riding and, no doubt, dirty dancing. ""I take my own kids there now,"" a nostalgic Westchester psychologist told me. ""It's a great family place.""    Others sounded appalled. ""All that heavy food,"" murmured a wraithlike friend. Having grown up in California, I had no Catskill memories to contend with, cherished or otherwise","my recollections of the region consisted of seeing the padlocked entrance to Grossinger's (which closed in 1986 and filed for bankruptcy four years later) when I'd driven from New York to Ithaca years ago. The Total Resort, Catskill Style",1990
1994,"The City Council is mounting a challenge to Mayor Rudolph W. Giuliani's plan to crack down on food vendors in midtown Manhattan.   The Council's consumer affairs committee passed a measure yesterday that would allow food vendors to operate on 17 midtown streets that were previously restricted and were among the streets subject to a vigorous enforcement effort by the Giuliani administration two months ago. Challenging the Mayor, Council Moves to Restore Food Vendors",,1990
1997,"General Electric Co's net income was up 13.1 percent, to $2.16 billion in second quarter from $1.91 billion a year earlier","revenue for quarter was up 15 percent, to $22 billion (S) G.E. Profit Up Despite Troubles",1990
1994,"The Council of Fashion Designers of America has announced the winners of its 1994 C.F.D.A. Awards, which are to be presented at a dinner on Jan. 30 at the New York State Theater at Lincoln Center.    RICHARD TYLER has been named women's wear designer of the year. VICTOR ALFARO, CYNTHIA ROWLEY and ROBERT MASSIMO FREDA won the Perry Ellis Award for New Fashion Talent. ROBERT LEE MORRIS and GENE MAYER are to be cited for accessories. CHRONICLE",,1990
1998,"Dave Anderson Sports of The Times column discusses relationship between Boston Red Sox Hall of Fame baseball player Ted Williams and retired Sen John Glenn, who at age 77 is to travel into space aboard space shuttle Discovery Sports of The Times",A Familiar Idol Talks About His 'Idol in Life',1990
1993,"A chart in Business Day on Friday, with an article about stocks that posted the biggest gains and losses in the first quarter, included an erroneous entry for Humana Inc. supplied by Media General Financial Services. Humana split 2 for 1 in the first quarter when it spun off its hospital management company, Galen Health Care Inc. Thus Humana was not the stock showing the largest percentage decline on the New York Stock Exchange in the quarter.   In addition, the three charts with the article, showing the biggest gainers and losers on the New York and American stock exchanges and the Nasdaq market, mislabeled the quarter covered. It was the first.   Corrections",,1990
1998,"Three professional surfers meet kindred spirits on an international quest for the ultimate wave. Pretty but all wet. Water World: Surf's Up, and It's Rough Out There",,1990
1996,"David Dumers, former Hudson County (NJ) Jail guard convicted in 1989 beating death of inmate Arnaldo Ortega, is sentenced to 15 years in prison","William Finck, another guard who pleaded guilty to simliar chages, receives 14-year sentence; Thomas Murphy, another guard who admitted covering up crime, is sentenced to four months (S) (New Jersey Daily Briefing) Former Jail Guard Convicted",1990
1996,"Marjory Banks Grannis, lecturer, community volunteer and mother of New York State Assemblyman Alexander B (Pete) Grannis, dies at age 80 (S) Marjory Grannis, 80, Community Leader",,1990
1999,"Article contends that while class warfare has largely disappeared from New York's labor scene, Transit Workers Union has embraced it with a vengeance in its campaign for new contract","union, representing 35,000 subway and bus workers, is distributing hundreds of thousands of copies of novel leaflet with cartoon of fat cat holding fistful of hundred dollar bills; leaflets insist that Mayor Rudolph Giuliani and Governor George Pataki have starved transit system of funds by giving billions of dollars in tax breaks to corporations (M) Fliers From Transit Union Draw on Class Distinctions",1990
1990,"* Du Pont Co., Wilmington, Del., will sell its formaldehyde plant in Toledo, Ohio, to Perstorp Polyols Inc. of Sweden. * Fedders Corp., Peapack, N.J., a maker of air-conditioners, will buy the Emerson Quiet Kool division of the Jepson Corp., a unit of Great American Management and Investment Inc., for $56 million and assumption of some liabilities. * Gleason Corp., Rochester, said its board had decided not to sell the company despite overtures from G. S. Beckwith Gilbert and Field Point Capital Management Co. * International Business Machines Corp., Armonk, N.Y., will move the headquarters of its worldwide communications division to Britain from Somers, N.Y. * Reliance Financial Services Corp., a subsidiary of Reliance Group Holdings Inc., a concern controlled by the family of Saul P. Steinberg, purchased 451,000 common shares in the UAL Corporation in the third quarter. UAL has about 21.9 million common shares outstanding. * Thorn EMI P.L.C., London, a telecommunications, electronics and entertainment conglomerate, will pay a maximum of $93.5 million for Filmtrax P.L.C., a British music publisher, and its U.S. subsidiary, Filmtrax Copyright Holdings Inc. BRIEFS",,1990
1994,"* Home Shopping Network Inc., St. Petersburg, Fla., and Kevin Harrington have formed a joint venture called HSN Direct to produce infomercials worldwide. Mr. Harrington, who will be president and chief executive of HSN Direct, was previously an executive vice president of National Media Corp., Philadelphia, an infomercial producer. Also joining HSN as chief operating officer is Bob Swift, who was previously senior vice president of marketing at Turner Broadcasting Sales Inc., Atlanta. * Leo Burnett Worldwide has merged its operations in Adelaide, Australia, with Andrew Robertson Advertising, Adelaide. The terms were not disclosed. The new agency, Robertson Leo Burnett/Adelaide, will operate from Burnett's current office. Andrew Robertson, managing partner at Robertson, will head the new shop. Miscellany",,1990
1993,"Old movies usually cost $14.98 in video stores, but at discount stores and supermarkets the price can drop to as low as $5.99.   For some movies, that is. You won't find ""The Sound of Music"" at $5.99, but the price applies to a raft of public-domain titles and B movies that studios and distributors figure they might as well sell as have lying around film vaults. Home Video",,1990
1998,"GRANT-Alice Waters. Passed away peacefully on December 18 at home in Hobe Sound, FL. She joined her beloved husband, Donald who died on November 28, 1998. Their extraordinary marriage lasted for over 66 years. Her humor and generosity touched all who knew her. She never forgot a birthday, admitting to only 39 of her own. Not only skillful at the bridge table, graceful on the tennis court and the dance floor, she was also an enthusiastic and creative hostess. She brightened the lives of friends and family alike. Loving mother of Sheila (deceased), Michael D. Grant Jr. of Greenwich, CT, Thomas W. Grant, and Patricia G. Warner, both of Locust Valley, NY. Grandmother to 10 grandchildren: Andrew, Luke, Michael, Bettina, Mimi and Tim Grant Jr., Alexander, Kate, Michael and Alice Warner (deceased). Motherin-law to Elizabeth L. Grant, Mary I. Grant and Douglas A. Warner III. A memorial mass will be held on Friday, March 5, 1999 at 4 PM at St. Christopher's Church, Hobe Sound, FL. Interment private. In lieu of flowers, the family has requested memorial contributions be made to St. Jude's Research Hospital, 501 St. Jude Place, Memphis, TN 38105-1905, and the Jupiter Island Clinic, PO Box 375, Hobe Sound, FL 33475. Paid Notice: Deaths  GRANT, ALICE WATERS",,1990
1996,"Jo Van Fleet, who won an Academy Award, a Tony Award and other honors for her portrayal of proud, stoical women, died yesterday at Jamaica Hospital in Queens. She was 81.         Ms. Van Fleet was known as an actress's actress, a highly skilled professional who worked with equal ease onstage, in films and on television. For her first screen appearance in 1955, she won an Academy Award as best supporting actress for playing James Dean's mother in Elia Kazan's film ""East of Eden."" Two years later, she won a Tony Award as best featured actress for her role as the irritable Jessie Mae Watts in Horton Foote's ""Trip to Bountiful.""    Jo Van Fleet, 81, an Actress Who Portrayed Proud Women",,1990
1995,"To the Editor:         Your survey of New Jersey's apple and cider industry (""Apples, Distilled to Their Essence,"" Oct. 8) prompts me to give up of our most closely held gastronomic secrets: a way to enjoy the taste of fresh cider all year.    Essence of Fall's Essence: How to Make Cider Syrup",,1990
1995,"SCORE one for proponents of the efficient market theory, which holds that prices change so rapidly to reflect new information that professional investors have no edge over the little guy. By extension, it is folly for investors to think that they can consistently beat an efficient market.   Recent work by Burton G. Malkiel, a professor at Princeton University, supports that view as it applies to mutual fund investing and contradicts several other recent studies that suggested winning funds tend to repeat their glowing performances. How to Judge? Flip a Coin",,1990
1995,"An article on Saturday about the Long Island Rail Road's purchase of double-decker coaches referred incorrectly to the places where such coaches are now used. Besides Chicago, they indeed include the East Coast -- in Boston and Miami. Corrections",,1990
1994,*3*** COMPANY REPORTS ** BCE Mobile reports earnings for Qtr to Sept 30,,1990
1997,"Barbara Bernstein article accuses Levittown, NY, Superintendent of Schools, Dr Herman A Sirois, of censorship",Sirois removed Robert Lipsyte book One Fat Summer from middle-school required reading list in response to parent's ojection (M) Censoring Books Is a Bad Idea,1990
1999,"Jane Auger letter corrects Dana Kennedy's August 29 article on film Outside Providence which described Rhode Island hot dogs as 'soggy' Squeaky, Not Soggy",,1990
1990,"LEAD: The International Labor Organization, a United Nations agency, issued a report today showing steadily rising inflation in many nations in the first few months of 1990. Britain's inflation rate rose to 9.4 percent from 7.7 percent in the comparable period in 1989. Inflation Rise Abroad",,1990
1990,LEAD:    THE MEXICAN MURALITS IN THE UNITED STATES    By Laurence P. Hurlburt    Illustrated. 320 pp. Albuquerque:    University of New Mexico Press. $45. POLITICS WRIT LARGE,,1990
1992,"Earl Wild  Pianist Carnegie Hall    Earl Wild will be 77 years old in a couple of weeks, and at an age when a number of people are slowing down, the American pianist was on the stage of Carnegie Hall on Friday night playing some of the most horrifyingly difficult piano music ever written. Mr. Wild began with three Rachmaninoff pieces: the ""Corelli"" Variations, his own transcription of the Vocalise and the B-flat-minor Sonata. He ended with Chopin's Opus 25 Etudes and the B-minor Scherzo. Classical Music in Review",,1990
2004,"RUBENSTEIN--Joel Kopel. 67, died February 1, 2004. Joel is survived by his loving partner, Julie Diller, sons Jeffery and Todd, and deceased son Lee, stepchildren Ken and Cathie Diller and grandchildren Alyssa Lee, and Kevin. In liew of flowers, Donations may be made to Hoag Cancer Center, Newport Beach, CA. Paid Notice: Deaths   RUBENSTEIN, JOEL KOPEL",,2000
2005,"The city medical examiner has changed the cause of death of a Bronx man to homicide, the police said yesterday. The man, Wellington Contreras, was struck last week in Bedford Park by a street sign that had been knocked down from a pole by a driver who had been shot. The driver, Shawron Hughes, 21, was shot by an unknown assailant and his car swerved out of control, hitting the pole and then knocking down the sign. Mr. Hughes is in stable condition at St. Barnabas Hospital, the police said.    Metro Briefing | New York: Bronx: Death Reclassified As A Homicide",,2000
2004,"Los Angeles Lakers prepare to face San Antonio Spurs in Game 4 of second-round playoff series, while Lakers guard Kobe Bryant also prepares for pretrial hearing in sexual assault case (M) With Bryant In Trouble, The Lakers Are as Well",,2000
2001,"Anna Kisselgoff reviews performance by Fort Worth Dallas Ballet at Joyce Theater (M) Dallas Ballet's Makeover, Sleek, Exuberant and Eclectic",,2000
2006,Anyone who wonders where the City of Yonkers got its reputation for ethical dubiosity can learn a thing or two by reading an audit released last week by State Comptroller Alan Hevesi. The Yonkers Shuffle,,2000
2005,Find out where George Washington led and Nathan Hale died. The Revolution in New York City,,2000
2002,"Basketball Notebook discusses new look of New Jersey Nets player Lucious Harris, who sheds his clear mask worn for broken bone on face, but cannot shed his slump in Game 3 of NBA finals against Los Angeles Lakers","Nets player Aaron Williams fouls out of Game 3 in seven minutes 12 seconds (M) Nets' Harris Changes His Look, but Not His Luck",2000
2009,"An article in some editions on Wednesday about the Pakistani foreign minister’s public criticisms of United States policy on Pakistan during a visit there by two senior American officials referred incorrectly at several points to the rank of one of those officials, the chairman of the Joint Chiefs of Staff. As the article initially noted, the chairman is Adm. Mike Mullen",he is not “General Mullen.”. Correction,2000
2004,"Fire in Mount Vernon, New York, apartment building displaces 54 people, but no one is seriously injured",officials believe that fire was started by accident by child left alone; photo (M) Mount Vernon Fire Displaces 54 Families,2000
2007,To the Editor:. Going to War Wasn’t the Answer (1 Letter),,2000
2002,"A general on Sunday denied that Iraq still has any weapons of mass destruction but hinted that, a decade ago, Baghdad came close to building an atom bomb. A Top Iraqi Aide Defies U.S. to Find Proof of Weapons",,2000
2009,"The Royal Opera House will produce a new work, called “The Twitter Opera,” in which the libretto will be composed of short messages sent on the popular social network. Also: a violinist for the National Symphony Orchestra performs the national anthem using an electric violin made from a regulation bat. The Twitter Opera and a Baseball Bat With Strings",,2000
