year,title,excerpt,decade
1985,"HARTSDALE THERE is no elaborate set, no huge orchestra, no supernumeraries. There is no diva in heavy makeup and grand costumes.

 But there are the Barber of Seville, and Madama Butterfly and the Student Prince. And there are performers with fine, trained voices, and there are even claques - audience members who cheer their favorites on with cries of bravo and brava.

The place is Sergio's, an Italian restaurant on Central Avenue here. For 11 years, Sergio's has been serving up arias and duets along with the veal marsala and zabaglione. Sunday nights two or three or four singers and a piano player perform works from well-known operas. Unlike opera stars on the traditional stage, they wear tuxedos and evening gowns, and they mingle with the diners in the manner of nightclub entertainers. Their performances, however, have become something of a tradition, to be cherished by a group of people that often feels like family. ABOUT WESTCHESTER/BRAVO! BRAVA!",,1980
1984,"The Ford Motor Credit Company is offering $100 million of 12 percent notes due in 1989 at a price of 99 3/4 to yield 12.068 percent. Underwriters are led by Salomon Brothers Inc. The notes, rated A-3 by Moody's and A- by Standard & Poor's, may be called by the company at any time at a price of 102. Goldman, Sachs & Company, Ford Motor Credit's regular investment banker and distributor of its commercial paper, was a co-lead manager of the offering. Ford Motor Credit",,1980
1983,"Although Interior Secretary James G. Watt's policies on land and water use have their greatest effect in the Rockies, he retains considerable support in this often conservative region while still the subject of much debate.   Though they have had sharp differences with him over specific policy questions, for example, many of the region's Democratic governors publicly credit Mr. Watt with improving the day-to-day working relationship between their states and the myriad Federal agencies that oversee the Rockies' vast inventory of public lands.   And as environmentalists rail against him, conservative Republicans in the region continue to see Mr. Watt as a sort of beleaguered hero. To them, Mr. Watt is struggling against a dark tide of environmentalism and attempting to give ranchers, miners and the other traditional users of the Federal lands a larger say in how they are used. WATT STILL BACKED BY MANY IN ROCKIES",,1980
1988,"LEAD: ''Apollo,'' ''Orpheus'' and ''Agon'' are sometimes collectively called a balletic Greek trilogy. Each has choreography by George Balanchine and music by Igor Stravinsky. Yet they were created many years apart and they are Greek in different ways. Whereas ''Apollo'' and ''Orpheus'' tell mythological stories, ''Agon'' is an abstraction, taking its title from a Greek word for ''contest. Review/Ballet",Greek Mythology's Role In 3 Balanchine Works,1980
1989,"LEAD: Dr. Irwin Lubowe, a dermatologist specializing in disorders of the hair and scalp, died Monday at Doctors Hospital in Manhattan after a long illness. He was 83 years old and lived in Manhattan. Dr. Irwin Lubowe, 83, Retired Dermatologist",,1980
1987,LEAD: ROBERT F. McDONALD always thought of himself as a resourceful man. But as he waited last summer to find out who would be affected by yet another round of layoffs at the International Paper Company's offices in New York City he found himself paralyzed with fear. FACING THE LOSS OF A JOB,,1980
1985,"''The Gipper would never quit until the final whistle,'' President Reagan said in a 1984 campaign speech, invoking once again the name of George Gipp, the legendary Notre Dame football player whose life he portrayed in the movie ''Knute Rockne - All American.''   Over the years, especially the Reagan years, Gipp has enjoyed such tributes, but an article in the current issue of Smithsonian magazine puts Gipp's refusal to quit in a different light.   ''It is halftime at the Notre Dame-Army game of 1920,'' writes James A. Cox, who contributes articles on sports to the magazine. ''Army is ahead and Rockne is giving one of his famous fight speeches. At the end every player is up, breathing fire, except Gipp, who lounges in the doorway looking bored. 'I don't suppose you have the slightest interest in this game,' Rockne snarls. 'You're wrong there, Rock,' Gipp answers. 'I've got 400 on this game, and I don't intend to blow it.' '' The Real George Gipp",,1980
1993,"Dr. Alison Grann and Dr. David Ethan Gutstein, residents in internal medicine at Beth Israel Hospital in Boston, were married yesterday at Temple Shaaray Tefila in Bedford, N.Y.   The bride, 28, graduated cum laude from George Washington University, from which she also received a medical degree. She is the daughter of Dr. and Mrs. Victor Grann of Westport, Conn. Her father, an oncologist, is the director of the Bennett Cancer Center in Stamford, Conn. Her mother, Phyllis Grann, is the chairman of the Putnam Berkley Group Inc., publishers in New York. Alison Grann and David Gutstein",,1990
1991,"The facts are not in dispute: On the night of May 23, 1989, Sarah Smith, a 43-year-old social worker, shot her sleeping husband once in the head with a .25-caliber pistol that she had taken from his pocket.   She wrapped his hulking 6-foot-3-inch body in two blankets, hoisted it onto a dolly and wheeled it to a car, and put it in the trunk. She then drove to Yonkers and left his body in a schoolyard. A week later, she turned herself in to an officer she knew at her local police station, in the 40th Precinct in the South Bronx. Murder Trial Focusing On Battered-Wife Issue",,1990
1998,"Depravity and unhappiness in New Jersey, via Solondz. Laceratingly funny. Faulty Families: Music Is Easy Listening and Dessert Is Hard to Take",,1990
1997,Kevin Barry reviews book Jane Austen: A Life by Claire Tomalin,drawing (L) Still Clueless,1990
1990,"LEAD:         *3*** COMPANY REPORTS **    *3* Great-West Lifeco        Qtr to Dec 31   1989   1988                       Revenue   1,175,494,000   1,281,712,000               Net inc   24,156,000   26,315,000               Share earns   .31   .34               Yr rev   5,299,215,000   4,967,191,000               Net inc   108,727,000   95,578,000               Share earns   1.39   1.23                 Great-West Lifeco reports earnings for Qtr to Dec 31",,1990
1994,"CITY COLLEGE DEMOTION CASE IS REOPENED   The Supreme Court gave City College of New York a second chance to show that its demotion of the outspoken chairman of its black studies department did not violate the Constitution. The Justices ordered an appeals court to reconsider the case in light of a Supreme Court decision, issued in May, that may give public employers more latitude to dismiss employees whose speech, while constitutionally protected, is likely to disrupt the workplace. A1. SEEKING NEW WAYS TO RESCUE PARKS   Maintenance has become a critical problem in the city's 905 playgrounds and 479 parks, especially the small ones that fail to attract the private donations that glamour parks like Central Park do. Now park advocates are debating a flurry of new ideas to change the way city parks have long been operated and financed. Many of the proposals put more responsibility in the private sector. A1. METRO DIGEST",,1990
1998,Correction on March 30 review of performance of Bach's St Matthew Passion at Church of Ascension in Manhattan Corrections,,1990
1993,"Lederle Laboratories, a maker of nicotine patches designed to help people quit smoking, said yesterday that it planned to reduce its prices by 33 percent temporarily and to give away more patches to state and local clinics. The company, which is lagging behind the market leaders Marion Merrell Dow and Ciba-Geigy, said last month that it would donate two million of its Prostep nicotine patches to smoking-cessation programs for state and local governments. Lederle, a Wayne, N.J., subsidiary of the pharmaceutical giant American Cyanamid Company, said yesterday it would add one million patches to the program. Three million patches would supply 75,000 smokers through a six-week program. For smokers who purchase the patches, Lederele is cutting the cost from $4 to $2.50 a day through June 30. LEDERLE REDUCES PRICE OF NICOTINE PATCHES",,1990
1999,"MALAMUT - Marguerite. The Board of Trustees of Parker Jewish Institute extend heartfelt sympathies to the Malamut family and to fellow Trustee Abraham on the passing of his wife Marguerite. May your memories of her offer comfort to you at this time. David Taub, Chairman of the Board David Glaser, President Paid Notice: Deaths  MALAMUT, MARGUERITE",,1990
1993,"* Software A.G., Reston, Va., to Tucker Wayne/Luckie & Co., Atlanta, previously at Smyth, Bauer & Lewis, Richmond. Billings were not disclosed. * Borders, Perrin & Norrander Inc., Portland, Ore., was awarded two new accounts previously handled by various agencies on a project basis: Smith Sports Optics, Ketchum, Idaho, a maker of goggles and sunglasses, and Insport, Beaverton, Ore., a sports apparel company. Billings were not disclosed. * Extra Broadway Corp., New York, to Beery Associates Advertising, New York, to handle its two Pauly's Italian Family Style Restaurants and Aspen Cafe. Billings were not disclosed. Accounts",,1990
1993,"Mr. and Mrs. John W. Mazzola of New York have announced April wedding plans for their daughter Amy Mazzola and Terence Brian Flynn, a son of James T. Flynn of New York and Mary L. Flynn of Chapel Hill, N.C.   Miss Mazzola is a vice president in corporate finance at J. P. Morgan & Company in New York. She and her fiance graduated cum laude from Harvard University. She was a member of the Junior Assembly in 1981. Her father, a former president of Lincoln Center in New York, is a management consultant to arts organizations in New York. Her mother, Sylvia Drulie Mazzola, is a former theatrical producer in New York. Amy Mazzola, Tad Flynn",,1990
1994,"An article on Tuesday about the Government's decision to drop its effort to bar a homosexual from serving in the Navy misstated a Federal appeals court's rationale in the case. The United States Court of Appeals for the Ninth Circuit, in San Francisco, found that under the old military policy restricting homosexuals, the Navy officer, Keith Meinhold, could not be discharged for merely saying he is homosexual. But the ruling did not say the policy violated equal protection guarantees of the Constitution. Corrections",,1990
1996,"In 1988, Alexi Indris-Santana was welcomed at Princeton University. The university was so impressed by how he had overcome an impoverished childhood and scored 1,410 out of a possible 1,600 on his Scholastic Assessment Test that  he was granted a $22,000 financial-aid package.         He was a lot less welcome after the authorities learned that his real name was James A. Hogue, that he was 11 years older than he said he was and that the  test scores were fake. In 1992, he pleaded guilty to theft by deception and served three years of a five-year prison term before being paroled in September.    NEW JERSEY DAILY BRIEFING",Student Jailed After Ruse,1990
1998,"World Monuments Fund, devoted to preserving endangered art and architecture, announcies grants to Jufu Hall in Beijing, Mesa Verde National Park in Colorado, Lednice Park in Czech Republic and Masaka Cathedral in Uganda",phots (S) Saving Endangered Art and Architecture,1990
1991,"Paul C. Bavitz was a key part of the Grumman Corporation's unsuccessful effort during the mid-1980's to win the contract for a new Navy attack plane. Now he and Grumman are getting a second crack at the program, and the stakes are high for the Bethpage, L.I.-based company.   Grumman said last week that it would bid to build the new plane, known as the A-X, as the leader of a team that includes the Boeing Company and the Lockheed Corporation. The Navy is beginning a new competition following the decision earlier this year by Defense Secretary Dick Cheney to cancel an earlier version, the A-12, when it ran into severe cost and schedule problems. The A-12 was being built jointly by the McDonnell Douglas Corporation and the General Dynamics Corporation, which in 1985 beat out Grumman, among others, for the $50 billion program. Making a Difference",A Second Chance for Grumman -- and Long Island,1990
1998,Carlyn Anne Meyer letter on Maureen Dowd's Aug 19 column holds feminists err in defending Pres Clinton Do Feminists Regret Standing By Clinton?,,1990
1998,"Jennifer Convertibles, major furniture chain in New York area, is ordered to compensate 780 customers",Atty Gen Dennis Vacco says complaints range from delivery of damaged furniture to refusing to honor warranties (S) Jennifer Convertibles Ordered to Compensate 780 Customers After Complaints Pile Up,1990
1991,"War in the Gulf 12-17    The oil slick in the gulf has spread, threatening vital desalting plants on Saudi Arabia's coast. Iraq fired missiles at Israel and Saudi Arabia again but they were intercepted by American Patriot missiles. Page 1    Saudis ask American companies for technology to halt spill 12    Airpower alone will not win the war, intelligence officials have concluded. The decision to launch a ground assault to drive Iraq from Kuwait will be President Bush's most important and difficult of the war. 1    As allies use its bases, Turkey faces implicit threat from Iraq 14    Are fake weapons confusing pilots in attacks on Iraq?  16    The Kremlin expressed reservations about the war led by the United States against Iraq, saying the conflict was extending beyond the United Nations' mandate and presenting ""a growing danger"" to Iraqi civilians. 8    President Hussein's closest advisers are like-minded aides who are bound to him by blood, either through family ties or shared responsibility for killing. But the last word on poltical or military strategy is his. 16    Islamic Asians are solidly behind President Hussein 17    Two dozen Iraqi aircraft have reportedly fled to Iran 16    Flaws in the Patriot air defense have become apparent. The warheads of some Iraqi missiles are getting through the defense system and exploding even though the missiles bearing them were shot down. 14    Reporter's Notebook: Keeping score in the desert 13    Despite missiles, hundreds of volunteers to work in Israel 14    U.S. evacuates Americans after missile attack on Riyadh 14    Tens of thousands protested the war in the gulf, invoking a specter of spiraling human and environmental costs. The protests, which were held in Washington and on the West Coast, were the largest so far. 17    Thousands converge in Germany to protest the war 17    Liberals in search of values run into discord over war 17   International 3-11    The KGB has been given new powers to search private businesses and to seize documents. President Gorbachev's order was another sign of his campaign to restore central control over the economy. 1    Yugoslav army retreats from threat to disarm police units 3    Europeans meet to discuss impact of emigration to the West 9    Czechoslovakia auctions stores to private buyers 10    American business groups call for new farm trade talks 6     Beijing sentenced eight dissidents, including the nation's leading human rights advocate and its foremost student leader, to relatively lenient sentences for their role in the Tiananmen Square democracy movement. 3    More rebels in Colombia agree to lay down their arms 4    Ecuador fights to keep out the region's drug traffickers 11    White House moves to end feud at information agency 10  National 18-21    Urban poverty remains entrenched in American society. After a decade of relative prosperity, the suffering has spread, and as Vietnam stalled the war on poverty, the gulf war will leave more problems unattended. 1    Minnesota's Teacher of the Year had just been layed off 20    A.C.L.U. elects a new president -- the first woman to serve 20    The nation's new child care measure was intended to help low- and middle-income families find care they could afford, but advocates say the Administration has delayed writing regulations needed to put it in effect. 18    Is another boon coming to Alaska? Gov. Walter Hickel of Alaska, who was elected in November as an independent, wants to use the state's revived oil wealth to prospect for new riches and build the state's infrastructure. 1    Deaths at rock concert renew a debate over seating safety 18    Hollywood Journal: The lingerie of the rich and famous 18   Regional 22-28    The Daily News strike has been a test for American labor, which has been losing ground for decades. The visibility of the paper in a city with strong labor traditions gives it the opportunity to display its will. 1    The collapse of Eastern Airlines has cost the jobs of 1,350 employees at La Guardia Airport, some of whom had worked for the airline for years. Another 350 workers lost their jobs at Newark International Airport. 22   $10 million gift to Yale honors founder of Time Magazine 22    East Harlem mourns teen-ager whose killing baffles the police 24    Suspects are sought in a series of rapes in the Bronx and Queens 24    Transit Museum, at the end of the line, is given a reprieve 25    Fungus disease attacking maple trees is spreading in New York 28    Neediest Cases 22    Obituaries 26    Jack Schaefer, author of westerns, including ""Shane""    Arts/Reviews 44    Photo portraits at National Gallery    Campus Life 31-33    Fashion 36-37    Life Style 34    Pastimes 45-46    Weddings 40-43 NEWS SUMMARY",,1990
1997,"HYLAND-Fannie (nee Irwin). On December 27, 1997. Of Newtowngore, Co. Leitrim, Ireland. Loving wife of the late William J. (retired MABSTOA). Beloved mother of Thomas (retired NYPD) and daughter-in-law Victoria. Grandmother of Brian, Alison and James. Also survived by her brother, John Irwin of Ireland. Visiting at the Albert R. Conner-Colonial Funeral Home, 4955 Broadway (at West 207th St.), NYC, Monday, 2-5 and 7-9 PM. Funeral mass Tuesday, 10 AM, Mother Cabrini Chapel. Interment Long Island National Cemetery. Paid Notice: Deaths  HYLAND, FANNIE (NEE IRWIN)",,1990
1997,David Willis McCullough reviews book Echo House by Ward Just (M) The Ruling Class,,1990
1994,"The chairman of E. I. du Pont de Nemours & Company, Edgar S. Woolard Jr., said last week that the company did not plan to use proceeds from a $3.4 billion bond sale to buy back stock from the Seagram Company.   Mr. Woolard said a notice by Du Pont to the Securities and Exchange Commission recently that it planned to sell the bonds was a ""routine shelf registration"" that would allow the company to refinance as needed ""over the next couple of years."" Du Pont Denies Seagram Move",,1990
1992,"As the Iran-contra trial of Clair E. George unfolds in Federal District Court here, the Central Intelligence Agency finds itself on the kind of display it abhors.   The agency is a citadel to secrecy, its officers steeped in codes of silence and loyalty. But the trial of Mr. George, the most-senior agency official to be charged in the Iran-contra affair, has featured long discussions of agency procedures, the exposure of C.I.A. cables and briefing books, and often-dramatic accounts of how its senior people behaved in a crisis. Trial Puts Unwelcome Light on C.I.A.",,1990
1992,"When the telephone call woke Georgia Thweatt at 5:30 A.M. on a recent Saturday, she cried for 45 minutes. Then she got up, took a taxicab from Miracle House on West 43d Street to New York Hospital and kissed her 31-year-old son Dwayne goodbye.   Two days later, as Ms. Thweatt packed to return to her life in Richmond, Va., as nurse, Army Reserve lieutenant and mother now of only four, her face was smooth, her voice steady and her eyes filled not with grief but with a quiet fire. Haven in the Grim World of AIDS",Miracle house Helps Visitors Comfort Dying Relatives,1990
1991,"New York City will have to build as many as three new garbage incinerators, in part because it will not be able to recycle as much trash as state goals call for, the Dinkins administration has concluded.   The new incinerators could cost at least $1 billion and will most likely prompt fierce opposition from environmental and community groups. In his 1989 mayoral campaign, David N. Dinkins had held out hope that the city would be able to address its trash disposal needs without resorting to new incinerators.   But in a plan to be disclosed today, Dinkins administration officials acknowledge that in addition to expanding three existing plants, two to three additional new incinerators will be needed.  Burning Plus Recycling    The administration also said that the city would have to burn 68 percent of its trash, slightly less than what was contemplated by the Koch administration.  The city collects 14,500 tons of waste a day. ""Even with very aggressive recycling, we still need to burn 10,000 tons,"" Steven M. Polan, the city's Sanitation Commissioner, said in an interview yesterday.   Many environmental and community groups have vehemently opposed building new incinerators because of concern over worsening air quality and neighborhood disruption by truck traffic. Incinerators emit several kinds of contaminants including soot particles containing lead, acid gases and dioxin, considered to be health risks.    The city will be able to recycle 25 percent of its trash by the year 2000, the same level required by city law but less than a state goal of as much as 42 percent by 1997, Mr. Polan said.    But any more than 25 percent cannot be economically justified because recycling markets will not be sufficiently developed to absorb all the material that New Yorkers could separate for recycling, he said.   Opponents of incinerators are very likely to take issue with the Sanitation Department analysis that only 25 percent recycling is economically feasible.   But city officials say that just to reach the 25 percent level will require adding to the six materials many New Yorkers currently separate for recycling pickup. About 6 percent of the trash collected by the Sanitation Department is now being separated under the city's struggling two-and-a-half-year-old recycling program.   Mr. Polan is to present highlights of the administration's plan at a state legislative hearing on solid waste today at 11 A.M. at 270 Broadway in New York City. A city solid waste management plan required by state law -- already five months late -- is expected to be completed and released for public comment by Nov. 1, Mr. Polan said. In the interview yesterday, Mr. Polan offered only an outline of the plan, and it was unclear when the new incinerators would be built.    After hearings in November and December, the plan will be modified and submitted to the state Department of Environmental Conservation. The city cannot build trash processing or disposal plants until the plan receives state approval.   Many officials, including Mr. Dinkins's First Deputy Mayor, Norman Steisel, maintain that recycling has limits and that with landfill capacity running out, the city has no alternative except to burn a substantial amount of its trash. Incineration proponents say modern plants are safe if properly maintained. Dinkins' 1989 Promise    In 1989, Mr. Dinkins promised to delay a decision until 1993 about building more incinerators, pending a review of the city's trash disposal needs.   ""We're not going to have giant, mass-burn incinerators in every borough belching poison into the air,"" he said, after receiving the endorsement of the New York League of Conservation Voters.   The next February, Mr. Dinkins said at a conference on the environment: ""You all know that I have some very serious concerns about the consequences of proceeding with resource-recovery plants, especially with regard to the toxic ash produced by that technology. Unless my concerns are adequately answered, we will not proceed with incineration.""   Resource-recovery plants are incinerators that convert garbage-generated steam into electric power.   Under one Koch administration plan, new incinerators would have been built in each borough. Mr. Polan said the Dinkins plan would require building two or three new incinerators and the expansion of three existing units, which is under way. Construction of an incinerator at the old Brooklyn Navy Yard remains a possibility, a department spokeswoman, Anne Canty, said.   The Sanitation Department's study found that incineration is the cheapest way to dispose of trash, Mr. Polan said, but an approach limited to burning would be at odds with the state's environmental priorities and increasing national emphasis on more recycling.   He reiterated that the city's current recycling program is struggling and needs an overhaul badly. Such an overhaul would require big revisions in the city's mandatory recycling law, which contemplated 25 percent recycling by spring 1994.   Sounding an old theme, Mr. Polan said achieving 25 percent recycling at an affordable cost will require changes in sanitation union work rules. The department needs more flexibility to move workers from collection to recycling routes, he said. Bargaining between management and the union has gone nowhere on the issue. NEW INCINERATORS TERMED ESSENTIAL IN NEW YORK CITY",,1990
1995,COOLIO: 'GANGSTA'S PARADISE' Tommy Boy    Pop Briefs,,1990
